Name,Handle,Timestamp,Verified,Content,Comments,Retweets,Likes,Analytics,Tags,Mentions,Emojis,Profile Image,Tweet Link,Tweet ID
Marvel Studios,@MarvelStudios,2024-12-25T02:05:00.000Z,True,Unwrap a new episode of #WhatIf S3 tonight at midnight PT on ! ,37,320,2.6K,178K,['#WhatIf'],['@DisneyPlus'],"['\\U0001f381', '\\U0001f384']",https://pbs.twimg.com/profile_images/1837996521809211392/ZPfq2KOE_normal.jpg,https://x.com/MarvelStudios/status/1871738886596272612,tweet_id:1871738886596272612
Fantastic Four,@FantasticFour,2024-12-25T01:00:02.000Z,True,"One more ornament to make our tree Fantastic The Fantastic Four: First Steps arrives in theaters July 25, 2025.",194,3.8K,24K,878K,[],[],['\\U0001f384'],https://pbs.twimg.com/profile_images/1757797407189086208/tyQc3y2E_normal.jpg,https://x.com/FantasticFour/status/1871722539107676222,tweet_id:1871722539107676222
Marvel Studios,@MarvelStudios,2024-12-25T02:05:00.000Z,True,Unwrap a new episode of #WhatIf S3 tonight at midnight PT on ! ,37,320,2.6K,178K,['#WhatIf'],['@DisneyPlus'],"['\\U0001f381', '\\U0001f384']",https://pbs.twimg.com/profile_images/1837996521809211392/ZPfq2KOE_normal.jpg,https://x.com/MarvelStudios/status/1871738886596272612,tweet_id:1871738886596272612
Marvel Studios,@MarvelStudios,2024-12-24T17:00:02.000Z,True,Easy peasy Episode 3 of #WhatIf S3 is now streaming on . Unwrap a new episode daily!,34,205,1.7K,134K,['#WhatIf'],['@DisneyPlus'],['\\U0001f44c'],https://pbs.twimg.com/profile_images/1837996521809211392/ZPfq2KOE_normal.jpg,https://x.com/MarvelStudios/status/1871601740069671044,tweet_id:1871601740069671044
Marvel Studios,@MarvelStudios,2024-12-24T15:00:02.000Z,True,‘Tis the Season! #WhatIf S3 is now streaming on . Unwrap a new episode daily!,22,283,2.4K,158K,['#WhatIf'],['@DisneyPlus'],"['\\U0001f384', '\\U0001f381']",https://pbs.twimg.com/profile_images/1837996521809211392/ZPfq2KOE_normal.jpg,https://x.com/MarvelStudios/status/1871571543597449544,tweet_id:1871571543597449544
Marvel Studios,@MarvelStudios,2024-12-24T02:00:01.000Z,True,"Two super soldiers walk into a mission... The Winter Soldier and Red Guardian return in Episode 3 of #WhatIf S3, streaming tonight at midnight PT on .",44,392,2.8K,226K,['#WhatIf'],['@DisneyPlus'],"['\\U0001f44a', '\\U0001f4a5']",https://pbs.twimg.com/profile_images/1837996521809211392/ZPfq2KOE_normal.jpg,https://x.com/MarvelStudios/status/1871375245816279084,tweet_id:1871375245816279084
A. Lamp,@AlexLampley,2024-12-23T11:46:27.000Z,False,I love Ep. 2 of the new season of #WhatIfS3. Kingo & Agatha. ,3,26,304,105K,['#WhatIfS3'],['@MarvelStudios'],"['\\U0001f90c\\U0001f3fd', '\\U0001f48b']",https://pbs.twimg.com/profile_images/1774226999508176896/PcOgYmyZ_normal.jpg,https://x.com/AlexLampley/status/1871160436319764854,tweet_id:1871160436319764854
Marvel Studios,@MarvelStudios,2024-12-23T17:00:00.000Z,True,"Hollywood  Bollywood

Episode 2 of #WhatIf S3 is now streaming on . Unwrap a new episode daily!",104,495,5.4K,278K,['#WhatIf'],['@DisneyPlus'],['\\U0001f91d'],https://pbs.twimg.com/profile_images/1837996521809211392/ZPfq2KOE_normal.jpg,https://x.com/MarvelStudios/status/1871239344683389404,tweet_id:1871239344683389404
Marvel Studios,@MarvelStudios,2024-12-23T02:00:00.000Z,True,"It's showtime Agatha Harkness and Kingo return in Episode 2 of #WhatIf S3, streaming tonight at midnight PT on !",62,535,3.8K,248K,['#WhatIf'],['@DisneyPlus'],"['\\u2b50\\ufe0f', '\\U0001f3a5']",https://pbs.twimg.com/profile_images/1837996521809211392/ZPfq2KOE_normal.jpg,https://x.com/MarvelStudios/status/1871012853429174478,tweet_id:1871012853429174478
Marvel Studios,@MarvelStudios,2024-12-22T17:00:02.000Z,True,You rang? #WhatIf S3 is now streaming on . Unwrap a new episode daily for 8 days!,41,255,1.9K,153K,['#WhatIf'],['@DisneyPlus'],['\\U0001f514'],https://pbs.twimg.com/profile_images/1837996521809211392/ZPfq2KOE_normal.jpg,https://x.com/MarvelStudios/status/1870876965068292255,tweet_id:1870876965068292255
Marvel Studios,@MarvelStudios,2024-12-22T16:01:09.000Z,True,"What If... the multiverse were made of 15,000 toppling dominos? A most satisfying watch indeed  https://youtu.be/AH3o3Z24mw8 

Check out this #WhatIf Season 3 inspired domino art by Lily Hevesh of , and watch a new episode daily for 8 days straight, only on .",27,135,1.2K,125K,['#WhatIf'],"['@Hevesh5', '@DisneyPlus']",['\\U0001f440'],https://pbs.twimg.com/profile_images/1837996521809211392/ZPfq2KOE_normal.jpg,https://x.com/MarvelStudios/status/1870862146252530017,tweet_id:1870862146252530017
Marvel Studios,@MarvelStudios,2024-12-22T02:05:00.000Z,True,"1 final watch. 8 episodes left.

Unwrap new episodes of #WhatIf S3 starting tonight at midnight PT, only on ! ",90,893,6.9K,358K,['#WhatIf'],['@DisneyPlus'],['\\U0001f381'],https://pbs.twimg.com/profile_images/1837996521809211392/ZPfq2KOE_normal.jpg,https://x.com/MarvelStudios/status/1870651722965622956,tweet_id:1870651722965622956
Marvel Studios,@MarvelStudios,2024-12-22T02:00:01.000Z,True,"Incoming: The Mighty Avenger Protocol Assemble for Episode 1 of #WhatIf S3, streaming tonight at midnight PT on !",43,552,4.2K,280K,['#WhatIf'],['@DisneyPlus'],['\\U0001f440'],https://pbs.twimg.com/profile_images/1837996521809211392/ZPfq2KOE_normal.jpg,https://x.com/MarvelStudios/status/1870650469644693875,tweet_id:1870650469644693875
Marvel Studios,@MarvelStudios,2024-12-21T19:00:01.000Z,True,The time is near #WhatIf S3 arrives tomorrow on . Unwrap a new episode daily for 8 days straight!,42,449,3.1K,189K,['#WhatIf'],['@DisneyPlus'],['\\U0001f570\\ufe0f'],https://pbs.twimg.com/profile_images/1837996521809211392/ZPfq2KOE_normal.jpg,https://x.com/MarvelStudios/status/1870544771032199207,tweet_id:1870544771032199207
Marvel Studios,@MarvelStudios,2024-12-21T18:00:01.000Z,True,"Action! #WhatIf S3 inspired art illustrated by . Stream a new episode daily starting tomorrow, December 22 on !",55,641,4.3K,234K,['#WhatIf'],"['@montadrew', '@DisneyPlus']","['\\u2b50\\ufe0f', '\\U0001f3a5']",https://pbs.twimg.com/profile_images/1837996521809211392/ZPfq2KOE_normal.jpg,https://x.com/MarvelStudios/status/1870529673228153166,tweet_id:1870529673228153166
Marvel Studios,@MarvelStudios,2024-12-21T17:00:00.000Z,True,The 8-day adventure begins tomorrow.#WhatIf S3 arrives December 22 on . Unwrap a new episode daily for 8 days! ,41,393,2.5K,152K,['#WhatIf'],['@DisneyPlus'],['\\U0001f381'],https://pbs.twimg.com/profile_images/1837996521809211392/ZPfq2KOE_normal.jpg,https://x.com/MarvelStudios/status/1870514569216414030,tweet_id:1870514569216414030
Marvel Studios,@MarvelStudios,2024-12-20T18:00:00.000Z,True,"You up for an adventure, partner? #WhatIf S3 inspired art illustrated by . Stream a new episode daily starting December 22, only on !",33,348,2.8K,152K,['#WhatIf'],"['@montadrew', '@DisneyPlus']",['\\U0001f920'],https://pbs.twimg.com/profile_images/1837996521809211392/ZPfq2KOE_normal.jpg,https://x.com/MarvelStudios/status/1870167281910886796,tweet_id:1870167281910886796
Marvel Studios,@MarvelStudios,2024-12-19T21:00:00.000Z,True,"Lights, Camera, Agatha #WhatIf S3 arrives December 22 on . Unwrap a new episode daily for 8 days straight!",133,1.1K,6.3K,281K,['#WhatIf'],['@DisneyPlus'],['\\U0001f49c'],https://pbs.twimg.com/profile_images/1837996521809211392/ZPfq2KOE_normal.jpg,https://x.com/MarvelStudios/status/1869850193384092052,tweet_id:1869850193384092052
Marvel Studios,@MarvelStudios,2024-12-18T00:04:51.000Z,True,"The gift that keeps on giving Catch a new episode of #WhatIf S3 daily for 8 days, only on !",45,442,3.6K,271K,['#WhatIf'],['@DisneyPlus'],['\\U0001f381'],https://pbs.twimg.com/profile_images/1837996521809211392/ZPfq2KOE_normal.jpg,https://x.com/MarvelStudios/status/1869171936728916276,tweet_id:1869171936728916276
Marvel Studios,@MarvelStudios,2024-12-17T02:22:17.000Z,True,Time is ticking #WhatIf S3 arrives December 22 on .,65,658,4.4K,218K,['#WhatIf'],['@DisneyPlus'],['\\U0001f570\\ufe0f'],https://pbs.twimg.com/profile_images/1837996521809211392/ZPfq2KOE_normal.jpg,https://x.com/MarvelStudios/status/1868844131478540584,tweet_id:1868844131478540584
Marvel Studios,@MarvelStudios,2024-12-15T17:00:00.000Z,True,"In one week, unwrap a new episode daily for 8 days straight #WhatIf S3 arrives December 22 on .",197,1.8K,7.5K,600K,['#WhatIf'],['@DisneyPlus'],['\\U0001f381'],https://pbs.twimg.com/profile_images/1837996521809211392/ZPfq2KOE_normal.jpg,https://x.com/MarvelStudios/status/1868340242895294586,tweet_id:1868340242895294586
Marvel Studios,@MarvelStudios,2024-12-13T20:30:00.000Z,True,Time is of the essence #WhatIf S3 arrives December 22 on . Unwrap a new episode daily for 8 days straight!,88,1.4K,8.1K,444K,['#WhatIf'],['@DisneyPlus'],['\\U0001f570\\ufe0f'],https://pbs.twimg.com/profile_images/1837996521809211392/ZPfq2KOE_normal.jpg,https://x.com/MarvelStudios/status/1867668314375204990,tweet_id:1867668314375204990
Marvel Studios,@MarvelStudios,2024-12-12T19:00:01.000Z,True,"So much to celebrate at last night’s Launch Event for #WhatIf S3, streaming December 22 on ! Unwrap a new episode daily for 8 days ",17,157,1.4K,150K,['#WhatIf'],['@DisneyPlus'],['\\U0001f381'],https://pbs.twimg.com/profile_images/1837996521809211392/ZPfq2KOE_normal.jpg,https://x.com/MarvelStudios/status/1867283282636734815,tweet_id:1867283282636734815
Empire,@empiremagazine,2024-12-12T16:00:01.000Z,True," RED ALERT! #CaptainAmerica and Red Hulk hit the cover of Empire’s world-exclusive #BraveNewWorld issue, featuring Anthony Mackie, Harrison Ford and more on a new era of the MCU.

On sale Thursday 19 December.

READ MORE: https://empireonline.com/movies/news/empires-world-exclusive-captain-america-brave-new-world-covers-revealed/…",57,879,4.5K,291K,"['#CaptainAmerica', '#BraveNewWorld']",[],['\\U0001f6a8'],https://pbs.twimg.com/profile_images/1571061983/empireicon_normal.png,https://x.com/empiremagazine/status/1867237985441218855,tweet_id:1867237985441218855
Marvel Studios,@MarvelStudios,2024-12-12T06:46:13.000Z,True,#WhatIf S3 arrives December 22 on . Unwrap a new episode daily for 8 days straight! ,5,46,328,86K,['#WhatIf'],['@DisneyPlus'],['\\U0001f381'],https://pbs.twimg.com/profile_images/1837996521809211392/ZPfq2KOE_normal.jpg,https://x.com/MarvelStudios/status/1867098613081575439,tweet_id:1867098613081575439
Marvel Studios,@MarvelStudios,2024-12-12T06:06:20.000Z,True,Howard the Duck + Darcy: The story continues…   #WhatIf S3,21,157,1.3K,156K,['#WhatIf'],['@SethGreen'],['\\U0001faf6'],https://pbs.twimg.com/profile_images/1837996521809211392/ZPfq2KOE_normal.jpg,https://x.com/MarvelStudios/status/1867088580176450024,tweet_id:1867088580176450024
Marvel Studios,@MarvelStudios,2024-12-12T05:13:32.000Z,True,"Seth Green, Director Bryan Andrews and Executive Producer Brad Winderbaum reunite for the #WhatIf S3 Launch Event ",25,208,2.1K,187K,['#WhatIf'],[],['\\U0001f4f8'],https://pbs.twimg.com/profile_images/1837996521809211392/ZPfq2KOE_normal.jpg,https://x.com/MarvelStudios/status/1867075290780012674,tweet_id:1867075290780012674
Marvel Studios,@MarvelStudios,2024-12-12T05:01:28.000Z,True,The #WhatIf S3 Launch Event gets festive,48,491,4.6K,225K,['#WhatIf'],[],['\\U0001f384'],https://pbs.twimg.com/profile_images/1837996521809211392/ZPfq2KOE_normal.jpg,https://x.com/MarvelStudios/status/1867072255349625123,tweet_id:1867072255349625123
Hawkeye,@hawkeyeofficial,2024-12-06T20:00:01.000Z,True,It's the most wonderful time of year Own the complete first season of #Hawkeye on 4K Ultra HD with never before seen bonus features: http://marvel.com/tv-shows/hawkeye/1#purchase-11…,30,172,1K,162K,['#Hawkeye'],[],['\\U0001f3f9'],https://pbs.twimg.com/profile_images/1836457131157110784/veOEC55q_normal.jpg,https://x.com/hawkeyeofficial/status/1865124052324749688,tweet_id:1865124052324749688
Loki,@LokiOfficial,2024-12-06T18:00:02.000Z,True,For all time always. Own #Loki Season 2 now on 4K Ultra HD with never before seen bonus features: http://marvel.com/tv-shows/loki#purchase-7…,27,192,1.4K,147K,['#Loki'],[],['\\U0001f49a'],https://pbs.twimg.com/profile_images/1836461268145954816/uiXOLVWw_normal.jpg,https://x.com/LokiOfficial/status/1865093858121650340,tweet_id:1865093858121650340
Marvel Entertainment,@Marvel,2024-12-04T22:30:09.000Z,True,"Learn how some of your favorite characters were brought to life in the MCU with Ryan Meinerding, the Head of Visual Development at Marvel Studios.  Listen to the latest episode of The Official Marvel Podcast: http://marvel.com/the-official-marvel-podcast…",15,87,689,187K,[],[],['\\U0001f3a7'],https://pbs.twimg.com/profile_images/1834328195904282624/_CAUqMol_normal.jpg,https://x.com/Marvel/status/1864437061228404893,tweet_id:1864437061228404893
Empire,@empiremagazine,2024-11-19T16:00:03.000Z,True,"EXCLUSIVE  #DaredevilBornAgain is “a continuation” of the Netflix show: “A lot of the history follows on,” Charlie Cox tells Empire.

READ MORE: https://empireonline.com/tv/news/daredevil-born-again-is-a-continuation-of-the-netflix-show-a-lot-of-the-history-follows-on/…",48,888,4K,343K,['#DaredevilBornAgain'],[],['\\U0001f608'],https://pbs.twimg.com/profile_images/1571061983/empireicon_normal.png,https://x.com/empiremagazine/status/1858903070484111767,tweet_id:1858903070484111767
Marvel Studios,@MarvelStudios,2024-11-19T20:00:01.000Z,True,See The Witches’ Road come to life Marvel Studios’ Assembled: The Making of #AgathaAllAlong is now on http://YouTube.com/Marvel.,86,489,3.6K,231K,['#AgathaAllAlong'],[],['\\U0001f342'],https://pbs.twimg.com/profile_images/1837996521809211392/ZPfq2KOE_normal.jpg,https://x.com/MarvelStudios/status/1858963462530994303,tweet_id:1858963462530994303
Marvel Studios,@MarvelStudios,2024-11-15T19:36:42.000Z,True,Can confirm The Ballad is still on repeat Marvel Studios’ Assembled: The Making of #AgathaAllAlong is now on http://YouTube.com/Marvel.,152,622,5.1K,295K,['#AgathaAllAlong'],[],['\\U0001f502'],https://pbs.twimg.com/profile_images/1837996521809211392/ZPfq2KOE_normal.jpg,https://x.com/MarvelStudios/status/1857508041710543067,tweet_id:1857508041710543067
Marvel Studios,@MarvelStudios,2024-11-15T18:00:01.000Z,True,#DeadpoolAndWolverine on repeat Now streaming only on .,138,653,4.8K,377K,['#DeadpoolAndWolverine'],['@DisneyPlus'],['\\U0001f501'],https://pbs.twimg.com/profile_images/1837996521809211392/ZPfq2KOE_normal.jpg,https://x.com/MarvelStudios/status/1857483710183899577,tweet_id:1857483710183899577
Marvel Studios,@MarvelStudios,2024-11-14T02:04:14.000Z,True,Tune in to the live premiere of Marvel Studios’ Assembled: The Making of #AgathaAllAlong ,99,460,2.7K,181K,['#AgathaAllAlong'],[],['\\U0001f52e'],https://pbs.twimg.com/profile_images/1837996521809211392/ZPfq2KOE_normal.jpg,https://x.com/MarvelStudios/status/1856880792745447635,tweet_id:1856880792745447635
Marvel Studios,@MarvelStudios,2024-11-14T02:00:00.000Z,True,"You will always be our coven  Join us for one last walk down the Witches' Road for a group watch of Assembled: The Making of #AgathaAllAlong, now on http://YouTube.com/Marvel.",145,1.2K,8.4K,272K,['#AgathaAllAlong'],[],['\\U0001f49c'],https://pbs.twimg.com/profile_images/1837996521809211392/ZPfq2KOE_normal.jpg,https://x.com/MarvelStudios/status/1856879725890965970,tweet_id:1856879725890965970
Marvel Studios,@MarvelStudios,2024-11-13T19:14:37.000Z,True,,35,480,2K,162K,[],[],['\\U0001f4cc'],https://pbs.twimg.com/profile_images/1837996521809211392/ZPfq2KOE_normal.jpg,https://x.com/MarvelStudios/status/1856777706177990886,tweet_id:1856777706177990886
Marvel Studios,@MarvelStudios,2024-11-11T21:00:00.000Z,True,When there's no new episode of #AgathaAllAlong this week All episodes are now streaming on .,391,1.7K,16K,889K,['#AgathaAllAlong'],['@DisneyPlus'],['\\U0001f62d'],https://pbs.twimg.com/profile_images/1837996521809211392/ZPfq2KOE_normal.jpg,https://x.com/MarvelStudios/status/1856079453522407580,tweet_id:1856079453522407580
Marvel Studios,@MarvelStudios,2024-11-11T20:00:14.000Z,True,Next on  Stream #DeadpoolAndWolverine tomorrow.,118,1.4K,9.9K,416K,['#DeadpoolAndWolverine'],['@DisneyPlus'],['\\u23ed\\ufe0f'],https://pbs.twimg.com/profile_images/1837996521809211392/ZPfq2KOE_normal.jpg,https://x.com/MarvelStudios/status/1856064410244010426,tweet_id:1856064410244010426
Marvel Studios,@MarvelStudios,2024-11-10T20:00:01.000Z,True,Not a basic witch in sight All episodes of #AgathaAllAlong are now streaming on .,55,424,3.9K,183K,['#AgathaAllAlong'],['@DisneyPlus'],['\\U0001f52e'],https://pbs.twimg.com/profile_images/1837996521809211392/ZPfq2KOE_normal.jpg,https://x.com/MarvelStudios/status/1855701969580785741,tweet_id:1855701969580785741
Marvel Studios,@MarvelStudios,2024-11-09T21:32:55.000Z,True,A dream team-up come true!  hits the stage to talk #Thunderbolts* #D23Brasil,55,358,4.1K,341K,"['#Thunderbolts', '#D23Brasil']",['@DavidKHarbour'],['\\u26a1\\ufe0f'],https://pbs.twimg.com/profile_images/1837996521809211392/ZPfq2KOE_normal.jpg,https://x.com/MarvelStudios/status/1855362961230991640,tweet_id:1855362961230991640
Marvel Studios,@MarvelStudios,2024-11-09T18:00:02.000Z,True,The sassiest coven you know All episodes of #AgathaAllAlong are now streaming on .,72,482,4.4K,180K,['#AgathaAllAlong'],['@DisneyPlus'],['\\U0001f49c'],https://pbs.twimg.com/profile_images/1837996521809211392/ZPfq2KOE_normal.jpg,https://x.com/MarvelStudios/status/1855309384940965930,tweet_id:1855309384940965930
Marvel Studios,@MarvelStudios,2024-11-08T20:00:00.000Z,True,"The original Green Witch Don’t miss Aubrey Plaza in #AgathaAllAlong, all episodes now streaming on .",130,870,6K,329K,['#AgathaAllAlong'],['@DisneyPlus'],['\\U0001f49a'],https://pbs.twimg.com/profile_images/1837996521809211392/ZPfq2KOE_normal.jpg,https://x.com/MarvelStudios/status/1854977188841296210,tweet_id:1854977188841296210
Marvel Studios,@MarvelStudios,2024-11-08T17:58:22.000Z,True,It really was #AgathaAllAlong All episodes are now streaming on .,90,509,4.7K,202K,['#AgathaAllAlong'],['@DisneyPlus'],['\\U0001f608'],https://pbs.twimg.com/profile_images/1837996521809211392/ZPfq2KOE_normal.jpg,https://x.com/MarvelStudios/status/1854946580195164502,tweet_id:1854946580195164502
Marvel Studios,@MarvelStudios,2024-11-07T23:54:38.000Z,True,All episodes of #AgathaAllAlong are now streaming on .,285,2.3K,11K,588K,['#AgathaAllAlong'],['@DisneyPlus'],"['\\U0001f49c', '\\U0001f49a']",https://pbs.twimg.com/profile_images/1837996521809211392/ZPfq2KOE_normal.jpg,https://x.com/MarvelStudios/status/1854673848861704557,tweet_id:1854673848861704557
Marvel Studios,@MarvelStudios,2024-11-04T18:17:40.000Z,True,Unravel the secrets of The Witches’ Road All episodes of #AgathaAllAlong are now streaming on .,74,367,4.5K,165K,['#AgathaAllAlong'],['@DisneyPlus'],['\\U0001f440'],https://pbs.twimg.com/profile_images/1837996521809211392/ZPfq2KOE_normal.jpg,https://x.com/MarvelStudios/status/1853501885967118578,tweet_id:1853501885967118578
Marvel Studios,@MarvelStudios,2024-11-03T20:00:01.000Z,True,"Lady Death  Don’t miss Aubrey Plaza in #AgathaAllAlong, now streaming on .

Costume by: Daniel Selon",56,407,3.8K,182K,['#AgathaAllAlong'],['@DisneyPlus'],"['\\U0001f480', '\\U0001f5a4']",https://pbs.twimg.com/profile_images/1837996521809211392/ZPfq2KOE_normal.jpg,https://x.com/MarvelStudios/status/1853165252848042273,tweet_id:1853165252848042273
Marvel Studios,@MarvelStudios,2024-11-03T19:00:01.000Z,True,"This is WICCAN  Don’t miss Joe Locke in #AgathaAllAlong, now streaming on .

Costume by: Daniel Selon",84,668,5.7K,271K,['#AgathaAllAlong'],['@DisneyPlus'],['\\U0001f499'],https://pbs.twimg.com/profile_images/1837996521809211392/ZPfq2KOE_normal.jpg,https://x.com/MarvelStudios/status/1853150153924137346,tweet_id:1853150153924137346
Marvel Studios,@MarvelStudios,2024-11-03T18:00:00.000Z,True,Our coven's first look at The Witches’ Road All episodes of #AgathaAllAlong are now streaming on .,33,372,3K,145K,['#AgathaAllAlong'],['@DisneyPlus'],['\\U0001f49c'],https://pbs.twimg.com/profile_images/1837996521809211392/ZPfq2KOE_normal.jpg,https://x.com/MarvelStudios/status/1853135052374528391,tweet_id:1853135052374528391
Marvel Studios,@MarvelStudios,2024-11-03T17:00:01.000Z,True,It really was #AgathaAllAlong All episodes are now streaming on .,65,553,4.4K,159K,['#AgathaAllAlong'],['@DisneyPlus'],"['\\U0001f3b6', '\\U0001f49c']",https://pbs.twimg.com/profile_images/1837996521809211392/ZPfq2KOE_normal.jpg,https://x.com/MarvelStudios/status/1853119956667478180,tweet_id:1853119956667478180
Marvel Studios,@MarvelStudios,2024-11-02T20:08:29.000Z,True,"A wardrobe fit for an icon Don’t miss Kathryn Hahn in #AgathaAllAlong, now streaming on .",31,420,3.8K,157K,['#AgathaAllAlong'],['@DisneyPlus'],['\\U0001f49c'],https://pbs.twimg.com/profile_images/1837996521809211392/ZPfq2KOE_normal.jpg,https://x.com/MarvelStudios/status/1852804997672497302,tweet_id:1852804997672497302
Marvel Studios,@MarvelStudios,2024-11-02T17:24:40.000Z,True,Some iconic moments from the finale All episodes of #AgathaAllAlong are now streaming on .,53,482,5.2K,163K,['#AgathaAllAlong'],['@DisneyPlus'],['\\U0001f49c'],https://pbs.twimg.com/profile_images/1837996521809211392/ZPfq2KOE_normal.jpg,https://x.com/MarvelStudios/status/1852763769929163038,tweet_id:1852763769929163038
Marvel Studios,@MarvelStudios,2024-11-02T16:00:01.000Z,True,We miss them already All episodes of #AgathaAllAlong are now streaming on .,179,1.6K,11K,314K,['#AgathaAllAlong'],['@DisneyPlus'],['\\U0001f62d'],https://pbs.twimg.com/profile_images/1837996521809211392/ZPfq2KOE_normal.jpg,https://x.com/MarvelStudios/status/1852742468804161752,tweet_id:1852742468804161752
Marvel Studios,@MarvelStudios,2024-11-01T21:00:01.000Z,True,Kathryn Hahn talks practical magicAll episodes of #AgathaAllAlong are now streaming on .,50,909,7.1K,210K,['#AgathaAllAlong'],['@DisneyPlus'],"['\\u2728', '\\u2728']",https://pbs.twimg.com/profile_images/1837996521809211392/ZPfq2KOE_normal.jpg,https://x.com/MarvelStudios/status/1852455577911239162,tweet_id:1852455577911239162
Marvel Studios,@MarvelStudios,2024-11-01T20:32:26.000Z,True,A Your Friendly Neighborhood Spider-Man prequel comic is swinging onto stands December 11! ,17,193,1.4K,185K,[],[],['\\U0001f578\\ufe0f'],https://pbs.twimg.com/profile_images/1837996521809211392/ZPfq2KOE_normal.jpg,https://x.com/MarvelStudios/status/1852448637709943208,tweet_id:1852448637709943208
Marvel Studios,@MarvelStudios,2024-11-01T20:00:00.000Z,True,We love our coven All episodes of #AgathaAllAlong are now streaming on .,44,537,4K,132K,['#AgathaAllAlong'],['@DisneyPlus'],['\\U0001f49c'],https://pbs.twimg.com/profile_images/1837996521809211392/ZPfq2KOE_normal.jpg,https://x.com/MarvelStudios/status/1852440476218966216,tweet_id:1852440476218966216
Marvel Studios,@MarvelStudios,2024-11-01T18:47:32.000Z,True, Go behind the scenes with #AgathaAllAlong Hair & Makeup masterminds Cindy Welles and Vasilios Tanis:,35,106,1K,135K,['#AgathaAllAlong'],[],['\\U0001f3ac'],https://pbs.twimg.com/profile_images/1837996521809211392/ZPfq2KOE_normal.jpg,https://x.com/MarvelStudios/status/1852422238991200291,tweet_id:1852422238991200291
Hawkeye,@hawkeyeofficial,2024-11-01T18:00:00.000Z,True,Bring Marvel Studios' #Hawkeye home for the holidays. Available on 4K Ultra HD December 3. Pre-order the collectable SteelBook now: http://marvel.com/tv-shows/hawkeye/1#purchase-11…,32,197,1K,142K,['#Hawkeye'],[],['\\U0001f3af'],https://pbs.twimg.com/profile_images/1836457131157110784/veOEC55q_normal.jpg,https://x.com/hawkeyeofficial/status/1852410275208802540,tweet_id:1852410275208802540
Marvel Comics,@MarvelComicsHQ,2024-11-01T14:00:01.000Z,True,"Death arrives on the new Marvel Studios Variant Cover featuring Aubrey Plaza’s portrayal of Rio Vidal from #AgathaAllAlong!  

See Imogene Chayes’ variant cover featured on #MarvelComics’ ‘Scarlet Witch’ #7, coming this December: http://spr.ly/6016ST0Ca",19,168,1.4K,123K,"['#AgathaAllAlong', '#MarvelComics']",[],['\\U0001f480'],https://pbs.twimg.com/profile_images/1802333761947770881/QyzbojaI_normal.jpg,https://x.com/MarvelComicsHQ/status/1852349882964623641,tweet_id:1852349882964623641
Mike Hamer,@mikehamer,2024-10-31T20:42:04.000Z,False,"#AgathaAllAlong - the finale - perfect viewing on Halloween. It’s been my favourite Marvel TV series so far. Currently got The Ballad of the Witches’ Road on a loop - “Down, down, down the road. Down the witches’ road…” ",7,50,516,74K,['#AgathaAllAlong'],[],['\\U0001f3b6'],https://pbs.twimg.com/profile_images/1716919827259166720/znKR-OgT_normal.jpg,https://x.com/mikehamer/status/1852088671828082838,tweet_id:1852088671828082838
Loki,@LokiOfficial,2024-11-01T17:05:19.000Z,True,Glorious purpose. Marvel Studios' #Loki Season 2 is available on 4K Ultra HD December 3. Pre-order the collectable SteelBook now: http://marvel.com/tv-shows/loki#purchase-7…,58,305,1.7K,145K,['#Loki'],[],['\\U0001f49a'],https://pbs.twimg.com/profile_images/1836461268145954816/uiXOLVWw_normal.jpg,https://x.com/LokiOfficial/status/1852396513638465775,tweet_id:1852396513638465775
Marvel Studios,@MarvelStudios,2024-10-31T20:21:11.000Z,True,"Happy Halloween, witches!

Watch all episodes of #AgathaAllAlong, now streaming on .: Aracely Munoz",99,1.1K,9.8K,192K,['#AgathaAllAlong'],['@DisneyPlus'],['\\U0001f3a8'],https://pbs.twimg.com/profile_images/1837996521809211392/ZPfq2KOE_normal.jpg,https://x.com/MarvelStudios/status/1852083417267241250,tweet_id:1852083417267241250
Marvel Studios,@MarvelStudios,2024-10-31T15:00:03.000Z,True,"Experience every twist, every secret, every episode All episodes of #AgathaAllAlong are now streaming on .",129,841,6.4K,338K,['#AgathaAllAlong'],['@DisneyPlus'],['\\U0001f52e'],https://pbs.twimg.com/profile_images/1837996521809211392/ZPfq2KOE_normal.jpg,https://x.com/MarvelStudios/status/1852002602256601416,tweet_id:1852002602256601416
