Name,Handle,Timestamp,Verified,Content,Comments,Retweets,Likes,Analytics,Tags,Mentions,Emojis,Profile Image,Tweet Link,Tweet ID
YouTube,@YouTube,2024-02-18T01:00:09.000Z,True,magical  tricks from Argentina performed by eze_yi  → https://yt.be/b1aVK,107,74,506,332K,[],[],"['\\u26bd\\ufe0f', '\\U0001fa84']",https://pbs.twimg.com/profile_images/1427292844612595720/RC1YSvuT_normal.jpg,https://x.com/YouTube/status/1759019939573236074,tweet_id:1759019939573236074
YouTube,@YouTube,2024-02-16T12:00:00.000Z,True,"Burak UZUN’s channel is a constant adrenaline rush, with POV Shorts riding through the wildest terrains in Turkey  → https://yt.be/ck2gg",122,100,670,346K,[],[],['\\U0001f6b2'],https://pbs.twimg.com/profile_images/1427292844612595720/RC1YSvuT_normal.jpg,https://x.com/YouTube/status/1758461223530578367,tweet_id:1758461223530578367
YouTube,@YouTube,2024-02-15T17:00:36.000Z,True,. &  quieren verte mover con su nueva canción Contigo  ¡sube tu reto #KarolGContigo en Shorts hoy! &  wanna see you get down to their new song Contigo  upload your #KarolGContigo challenge on Shorts today,25,22,123,195K,"['#KarolGContigo', '#KarolGContigo']","['@karolg', '@tiesto', '@karolg', '@tiesto']","['\\U0001f440', '\\U0001f440']",https://pbs.twimg.com/profile_images/1427292844612595720/RC1YSvuT_normal.jpg,https://x.com/YouTube/status/1758174482118631633,tweet_id:1758174482118631633
YouTube,@YouTube,2024-02-13T20:00:00.000Z,True,¿a cuál canción de  le sabes todas las letras? no puedo esperar para #KarolGContigo con  mañana which  song do you know all the words to? can’t wait for #KarolGContigo with  tomorrow ,69,47,306,250K,"['#KarolGContigo', '#KarolGContigo']","['@karolg', '@tiesto', '@karolg', '@tiesto']","['\\U0001f440', '\\U0001f440']",https://pbs.twimg.com/profile_images/1427292844612595720/RC1YSvuT_normal.jpg,https://x.com/YouTube/status/1757494854341234918,tweet_id:1757494854341234918
YouTube,@YouTube,2024-02-10T01:00:00.000Z,True,next trip is to Peru to learn calligraphy from  ,136,100,670,409K,[],['@calligraphilic'],['\\u270d\\ufe0f'],https://pbs.twimg.com/profile_images/1427292844612595720/RC1YSvuT_normal.jpg,https://x.com/YouTube/status/1756120799797301729,tweet_id:1756120799797301729
YouTube TV,@YouTubeTV,2024-02-09T21:15:01.000Z,True,"ready…break  it’s almost game time for Kansas City Chiefs vs. San Francisco 49ers.

watch Super Bowl LVIII live on CBS, this sunday! game coverage starts at 6pm ET. http://yt.be/superbowl.",61,36,248,273K,[],[],['\\U0001f44f'],https://pbs.twimg.com/profile_images/1587489111807361025/AwvHDJyB_normal.jpg,https://x.com/YouTubeTV/status/1756064180187152732,tweet_id:1756064180187152732
YouTube,@YouTube,2024-02-06T14:00:01.000Z,True," AI tools to spark everyone's creativity 
  the best of YouTube right in your living room
  more than $70B paid to creators, artists & media in 3 years 

Just a few highlights from 's community letter!→ http://yt.be/8r1NR",265,188,625,437K,[],['@nealmohan'],"['\\u2728', '\\U0001f4fa', '\\u2764\\ufe0f']",https://pbs.twimg.com/profile_images/1427292844612595720/RC1YSvuT_normal.jpg,https://x.com/YouTube/status/1754867544081535010,tweet_id:1754867544081535010
YouTube,@YouTube,2024-02-04T16:00:00.000Z,True,2nd and 3rd place… show yourself in the comments  ,200,70,473,389K,[],['@zachking'],['\\U0001f3c6'],https://pbs.twimg.com/profile_images/1427292844612595720/RC1YSvuT_normal.jpg,https://x.com/YouTube/status/1754172964432441639,tweet_id:1754172964432441639
YouTube,@YouTube,2024-02-01T14:00:00.000Z,True,"here's to all the Black creators who started trends, shared their stories, and made history on YouTube! Happy Black History Month ",214,159,828,498K,[],[],['\\u2764\\ufe0f'],https://pbs.twimg.com/profile_images/1427292844612595720/RC1YSvuT_normal.jpg,https://x.com/YouTube/status/1753055602232656326,tweet_id:1753055602232656326
YouTube,@YouTube,2024-01-30T19:00:01.000Z,True,living vicariously through 's peaceful videos  → https://yt.be/vyJmv,163,83,459,415K,[],['@staywithcotton'],['\\U0001f60c'],https://pbs.twimg.com/profile_images/1427292844612595720/RC1YSvuT_normal.jpg,https://x.com/YouTube/status/1752406326704066852,tweet_id:1752406326704066852
YouTube,@YouTube,2024-01-27T18:00:00.000Z,True,explore the world of 3D printing  with creators literally bringing their imaginations to life → https://yt.be/E4HSG,212,109,573,474K,[],[],['\\u2699\\ufe0f'],https://pbs.twimg.com/profile_images/1427292844612595720/RC1YSvuT_normal.jpg,https://x.com/YouTube/status/1751304060160856399,tweet_id:1751304060160856399
YouTube,@YouTube,2024-01-26T19:00:00.000Z,True,table top gaming has never been more exciting to play and watch  discover the creators who are bringing it to life → https://yt.be/YpzXN,201,260,1.2K,540K,[],[],"['\\u2728', '\\U0001f3b2']",https://pbs.twimg.com/profile_images/1427292844612595720/RC1YSvuT_normal.jpg,https://x.com/YouTube/status/1750956774482407462,tweet_id:1750956774482407462
YouTube,@YouTube,2024-01-20T16:00:01.000Z,True,"which vid r u clicking on first, be honest  ",245,62,457,406K,[],['@steveioe'],"['\\U0001f441', '\\U0001f441']",https://pbs.twimg.com/profile_images/1427292844612595720/RC1YSvuT_normal.jpg,https://x.com/YouTube/status/1748737149782884857,tweet_id:1748737149782884857
YouTube,@YouTube,2024-01-13T17:00:00.000Z,True,crafting in Japan with none other than   → https://yt.be/acYo3,261,95,639,430K,[],['@arte_arte_ssk'],['\\u2728'],https://pbs.twimg.com/profile_images/1427292844612595720/RC1YSvuT_normal.jpg,https://x.com/YouTube/status/1746215532066484507,tweet_id:1746215532066484507
YouTube,@YouTube,2024-01-06T18:00:00.000Z,True,which thumbnail face of Freckled Zelda and  is ur fav? we cant pick ,214,77,473,4.3M,[],['@oxDessyxo'],['\\U0001f648'],https://pbs.twimg.com/profile_images/1427292844612595720/RC1YSvuT_normal.jpg,https://x.com/YouTube/status/1743693916434505812,tweet_id:1743693916434505812
YouTube,@YouTube,2023-12-27T16:00:00.000Z,True,"Gabinouvilla, Paul Ferrer, and  say hello to each other and to 2024 ",199,78,433,372K,[],['@omurice_omelet'],"['\\U0001f4de', '\\U0001f386']",https://pbs.twimg.com/profile_images/1427292844612595720/RC1YSvuT_normal.jpg,https://x.com/YouTube/status/1740039840417058946,tweet_id:1740039840417058946
YouTube,@YouTube,2023-12-20T20:00:00.000Z,True,"., , NERDULT, and Shorts Break Official, pass thearound the  to say  to 2023",139,75,465,409K,[],"['@tooturnttoni', '@TheDonatoYoutu']","['\\U0001f4f1', '\\U0001f30e', '\\U0001f44b']",https://pbs.twimg.com/profile_images/1427292844612595720/RC1YSvuT_normal.jpg,https://x.com/YouTube/status/1737563520110117055,tweet_id:1737563520110117055
YouTube,@YouTube,2023-12-18T16:10:21.000Z,True,"Its Meissie, Hariyo Ardhito, Neetu Bisht, and Pani Bottle say hello to 2024 in style ",152,53,420,278K,[],[],['\\U0001f60e'],https://pbs.twimg.com/profile_images/1427292844612595720/RC1YSvuT_normal.jpg,https://x.com/YouTube/status/1736780953547120992,tweet_id:1736780953547120992
YouTube,@YouTube,2023-12-15T19:00:00.000Z,True,"we danced. we sang. we cried. & it’s all thanks to the music that carried us through 2023  explore your top artists, songs, & more from this year with #YouTubeMusicRecap → http://yt.be/MusicRecap",387,256,2.5K,391K,['#YouTubeMusicRecap'],[],['\\u2728'],https://pbs.twimg.com/profile_images/1427292844612595720/RC1YSvuT_normal.jpg,https://x.com/YouTube/status/1735736482269196621,tweet_id:1735736482269196621
YouTube,@YouTube,2023-12-14T20:00:01.000Z,True,.    wrap up 2023 with   ,102,59,325,236K,[],"['@rickylimon99', '@zacharyyryann', '@jtcaseyy']","['\\U0001f47b', '\\U0001f354', '\\U0001f921']",https://pbs.twimg.com/profile_images/1427292844612595720/RC1YSvuT_normal.jpg,https://x.com/YouTube/status/1735389196833972624,tweet_id:1735389196833972624
YouTube,@YouTube,2023-12-13T15:07:14.000Z,True,reply with your favorite sagittarius creator ,255,183,660,386K,[],[],['\\U0001f3f9'],https://pbs.twimg.com/profile_images/1427292844612595720/RC1YSvuT_normal.jpg,https://x.com/YouTube/status/1734953128309440784,tweet_id:1734953128309440784
YouTube TV,@YouTubeTV,2023-12-12T22:00:01.000Z,True,"32 players  32 teams

Tune in every Sunday at 1pm ET to catch your favorite out-of-market  games  http://yt.be/nflsundayticket",137,241,672,551K,[],['@NFL'],"['\\U0001f91d', '\\u27a1\\ufe0f']",https://pbs.twimg.com/profile_images/1587489111807361025/AwvHDJyB_normal.jpg,https://x.com/YouTubeTV/status/1734694619508777351,tweet_id:1734694619508777351
YouTube,@YouTube,2023-12-07T21:27:11.000Z,True,otw to Yube HQ in Gag City ,222,1.1K,5.8K,691K,[],[],['\\U0001f380'],https://pbs.twimg.com/profile_images/1427292844612595720/RC1YSvuT_normal.jpg,https://x.com/YouTube/status/1732874418693579163,tweet_id:1732874418693579163
YouTube TV,@YouTubeTV,2023-12-06T18:36:04.000Z,True,"Day 1   Day 365 of being an NFL fan.

The race to the playoffs is in full swing! Catch your favorite team’s out of market game with NFL Sunday Ticket, now starting at $79. http://yt.be/nflsundayticket",107,79,406,413K,[],[],['\\u27a1\\ufe0f'],https://pbs.twimg.com/profile_images/1587489111807361025/AwvHDJyB_normal.jpg,https://x.com/YouTubeTV/status/1732468968139461117,tweet_id:1732468968139461117
YouTube,@YouTube,2023-12-06T17:00:01.000Z,True,wrong answers only: _____ to my exes   #KissesToMyExes,193,70,463,438K,['#KissesToMyExes'],['@tatemcrae'],['\\U0001f92d'],https://pbs.twimg.com/profile_images/1427292844612595720/RC1YSvuT_normal.jpg,https://x.com/YouTube/status/1732444795614769476,tweet_id:1732444795614769476
YouTube,@YouTube,2023-12-04T15:00:00.000Z,True,taking these  tips on my next camping trip → https://yt.be/LwiPb,247,159,1K,2.5M,[],['@lotadogiblinu'],"['\\U0001fab5', '\\u26fa\\ufe0f']",https://pbs.twimg.com/profile_images/1427292844612595720/RC1YSvuT_normal.jpg,https://x.com/YouTube/status/1731689818071937072,tweet_id:1731689818071937072
YouTube,@YouTube,2023-12-04T14:01:46.000Z,True," trailer 1 alert  

head to the official  channel to join the countdown → https://yt.be/trailer1",611,3.6K,49K,5.1M,[],['@RockstarGames'],"['\\U0001f6a8', '\\U0001f6a8']",https://pbs.twimg.com/profile_images/1427292844612595720/RC1YSvuT_normal.jpg,https://x.com/YouTube/status/1731675163786158519,tweet_id:1731675163786158519
YouTube,@YouTube,2023-12-03T02:25:04.000Z,True,it's beginning to look a lot like #thankmas with    now live on 's channel! this year's fundraiser benefits ,123,115,1.2K,409K,['#thankmas'],"['@thethankmas', '@fuslie', '@Valkyrae', '@ethannestor', '@jacksepticeye', '@WCKitchen']",['\\u2728'],https://pbs.twimg.com/profile_images/1427292844612595720/RC1YSvuT_normal.jpg,https://x.com/YouTube/status/1731137444156731490,tweet_id:1731137444156731490
YouTube,@YouTube,2023-12-01T14:02:16.000Z,True,and you know where to find it ,1.1K,2K,49K,3.5M,[],[],['\\U0001f60e'],https://pbs.twimg.com/profile_images/1427292844612595720/RC1YSvuT_normal.jpg,https://x.com/YouTube/status/1730588123447349743,tweet_id:1730588123447349743
YouTube,@YouTube,2023-11-30T22:00:00.000Z,True,the #DuaLipaHoudini London premiere was AMAZING   join  for more fun on Shorts,149,115,592,328K,['#DuaLipaHoudini'],['@DUALIPA'],['\\U0001fa84'],https://pbs.twimg.com/profile_images/1427292844612595720/RC1YSvuT_normal.jpg,https://x.com/YouTube/status/1730345962378346929,tweet_id:1730345962378346929
YouTube,@YouTube,2023-11-27T17:00:00.000Z,True,"if you could send your ex *any* video, what would you send?   #KissesToMyExes",267,76,550,358K,['#KissesToMyExes'],['@tatemcrae'],['\\U0001f60f'],https://pbs.twimg.com/profile_images/1427292844612595720/RC1YSvuT_normal.jpg,https://x.com/YouTube/status/1729183303549198443,tweet_id:1729183303549198443
YouTube,@YouTube,2023-11-27T15:45:09.000Z,True,"new drop alert shop exclusive deals from , , ,  and more Creators you love today in the shop powered by YouTube and  http://yt.be/shopping",132,45,371,291K,[],"['@jesser', '@blogilates', '@Mythical', '@donutmedia', '@Shopify']","['\\U0001f6a8', '\\U0001f6a8']",https://pbs.twimg.com/profile_images/1427292844612595720/RC1YSvuT_normal.jpg,https://x.com/YouTube/status/1729164466565087316,tweet_id:1729164466565087316
YouTube TV,@YouTubeTV,2023-11-23T17:00:00.000Z,True,Shoutout to all the couch coaches brainstorming your team's next move when they’re down 21-0 at the half ,99,54,305,289K,[],[],['\\U0001fae1'],https://pbs.twimg.com/profile_images/1587489111807361025/AwvHDJyB_normal.jpg,https://x.com/YouTubeTV/status/1727733752271442219,tweet_id:1727733752271442219
YouTube,@YouTube,2023-11-22T17:00:00.000Z,True,. wants to know: which of these red flags make you go houdini?? ,159,71,648,323K,[],['@DUALIPA'],['\\U0001f9f5'],https://pbs.twimg.com/profile_images/1427292844612595720/RC1YSvuT_normal.jpg,https://x.com/YouTube/status/1727371361922793920,tweet_id:1727371361922793920
YouTube,@YouTube,2023-11-16T20:00:00.000Z,True,reply w your mood & i'll give you a  song  #DuaLipaHoudini,495,729,707,451K,['#DuaLipaHoudini'],['@DUALIPA'],['\\U0001f511'],https://pbs.twimg.com/profile_images/1427292844612595720/RC1YSvuT_normal.jpg,https://x.com/YouTube/status/1725242334487388200,tweet_id:1725242334487388200
YouTube,@YouTube,2023-11-13T14:00:00.000Z,True,take a deep breath in for four seconds. breathe out for four. do that four times ,377,202,1K,512K,[],[],['\\U0001f33b'],https://pbs.twimg.com/profile_images/1427292844612595720/RC1YSvuT_normal.jpg,https://x.com/YouTube/status/1724064573186085190,tweet_id:1724064573186085190
YouTube,@YouTube,2023-11-10T23:00:00.000Z,True,have you memorized ’s “Houdini” choreo yet? ,221,92,804,386K,[],['@DUALIPA'],"['\\U0001f511', '\\u2728']",https://pbs.twimg.com/profile_images/1427292844612595720/RC1YSvuT_normal.jpg,https://x.com/YouTube/status/1723113304686575724,tweet_id:1723113304686575724
YouTube TV,@YouTubeTV,2023-11-09T22:00:00.000Z,True,RT if you need some good luck in fantasy football this week ,58,62,260,288K,[],[],['\\U0001f91e'],https://pbs.twimg.com/profile_images/1587489111807361025/AwvHDJyB_normal.jpg,https://x.com/YouTubeTV/status/1722735819272630326,tweet_id:1722735819272630326
YouTube,@YouTube,2023-11-04T19:00:00.000Z,True,friendly reminder from  that growth takes time ,274,563,1.4K,483K,[],['@boxlapse'],['\\U0001f331'],https://pbs.twimg.com/profile_images/1427292844612595720/RC1YSvuT_normal.jpg,https://x.com/YouTube/status/1720878581029462434,tweet_id:1720878581029462434
YouTube,@YouTube,2023-11-03T21:00:00.000Z,True,this is your sign to take a 10 minute scrolling break ,545,200,1.3K,589K,[],[],['\\U0001f9d8'],https://pbs.twimg.com/profile_images/1427292844612595720/RC1YSvuT_normal.jpg,https://x.com/YouTube/status/1720546391796150650,tweet_id:1720546391796150650
YouTube,@YouTube,2023-11-01T21:09:12.000Z,True,"it’s giving NFL Sunday Ticket.

don’t miss the rest of the '23 season. NFL Sunday Ticket now starts at $174. ",201,76,436,392K,[],[],['\\U0001f485'],https://pbs.twimg.com/profile_images/1427292844612595720/RC1YSvuT_normal.jpg,https://x.com/YouTube/status/1719823929982763457,tweet_id:1719823929982763457
YouTube,@YouTube,2023-10-18T19:00:00.000Z,True,"check in on yourself, check in on your friends ",2.1K,798,2.9K,1.9M,[],[],['\\U0001fac2'],https://pbs.twimg.com/profile_images/1427292844612595720/RC1YSvuT_normal.jpg,https://x.com/YouTube/status/1714717988002152686,tweet_id:1714717988002152686
YouTube,@YouTube,2023-10-16T19:30:01.000Z,True,"so, who are you watching? ",1K,148,396,877K,[],[],['\\U0001f3a5'],https://pbs.twimg.com/profile_images/1427292844612595720/RC1YSvuT_normal.jpg,https://x.com/YouTube/status/1714000765180682528,tweet_id:1714000765180682528
YouTube Music,@youtubemusic,2023-10-11T19:03:53.000Z,True,"our en luv<3 playlist is coming to you & your amor this Hispanic Heritage Month  press play for , @natanaelcanomex, &  → http://yt.be/music/EnLuv",127,401,292,493K,[],"['@dannyluxxx', '@OvyOnTheDrums']",['\\u2665\\ufe0f'],https://pbs.twimg.com/profile_images/1861820278461939712/zD47L1pa_normal.jpg,https://x.com/youtubemusic/status/1712182249150398769,tweet_id:1712182249150398769
YouTube TV,@YouTubeTV,2023-10-08T17:45:00.000Z,True,be as subtle or unsubtle as you want when supporting your team from afar  #grwm #gameday,93,139,331,377K,"['#grwm', '#gameday']",[],['\\U0001f9e1'],https://pbs.twimg.com/profile_images/1587489111807361025/AwvHDJyB_normal.jpg,https://x.com/YouTubeTV/status/1711075231958520319,tweet_id:1711075231958520319
YouTube,@YouTube,2023-10-07T17:00:00.000Z,True,"reduce, reuse, recycle aaannnnnnnddd repeat ",220,137,987,504K,[],[],['\\U0001f60e'],https://pbs.twimg.com/profile_images/1427292844612595720/RC1YSvuT_normal.jpg,https://x.com/YouTube/status/1710701522185568521,tweet_id:1710701522185568521
YouTube TV,@YouTubeTV,2023-10-01T19:32:31.000Z,True,"Football Sunday Roll Call! 

Tell us where you’re watching from today using only emojis (bonus points for creativity) ",110,57,271,339K,[],[],"['\\U0001f5e3\\ufe0f', '\\U0001f447']",https://pbs.twimg.com/profile_images/1587489111807361025/AwvHDJyB_normal.jpg,https://x.com/YouTubeTV/status/1708565577302774016,tweet_id:1708565577302774016
YouTube Creators,@YouTubeCreators,2023-09-27T20:00:19.000Z,True,"if you could create *in any location* where would that be?

you'll be able to do that soon, thanks to new AI tools!!  &  give sneak peek at Dream Screen ",79,37,306,250K,[],"['@ColinandSamir', '@YouTubeLiaison']",['\\u2b50'],https://pbs.twimg.com/profile_images/1861787453994004480/U4KJtASt_normal.jpg,https://x.com/YouTubeCreators/status/1707123020463014354,tweet_id:1707123020463014354
YouTube,@YouTube,2023-09-27T13:30:01.000Z,True,happy birthday ! if you saw a search for last minute gifts it totally wasn’t me  ,170,141,1K,305K,[],['@google'],['\\U0001f440'],https://pbs.twimg.com/profile_images/1427292844612595720/RC1YSvuT_normal.jpg,https://x.com/YouTube/status/1707024796775518654,tweet_id:1707024796775518654
YouTube TV,@YouTubeTV,2023-09-26T15:50:04.000Z,True,a moment of zen for my football fam ,80,58,371,266K,[],[],"['\\U0001f9d8', '\\U0001f3c8']",https://pbs.twimg.com/profile_images/1587489111807361025/AwvHDJyB_normal.jpg,https://x.com/YouTubeTV/status/1706697655298978075,tweet_id:1706697655298978075
YouTube,@YouTube,2023-09-21T17:00:39.000Z,True,transport yourself to places you could only imagine - from a popcorn volcano to a jellybean beach  Dream Screen AI-generated backgrounds enter the chat in 2024.,167,96,590,427K,[],[],['\\U0001f92f'],https://pbs.twimg.com/profile_images/1427292844612595720/RC1YSvuT_normal.jpg,https://x.com/YouTube/status/1704903477061644509,tweet_id:1704903477061644509
YouTube,@YouTube,2023-09-21T14:31:43.000Z,True,get ready to make your wildest content dreams come true  introducing brand new AI tools from YouTube.,239,380,988,644K,[],[],['\\U0001f4ab'],https://pbs.twimg.com/profile_images/1427292844612595720/RC1YSvuT_normal.jpg,https://x.com/YouTube/status/1704865999357403143,tweet_id:1704865999357403143
TeamYouTube,@TeamYouTube,2023-09-17T15:46:08.000Z,True," your pregame plan  

to watch  Sunday Ticket from the YouTube app on your Smart TV, you need to set up your location. 

watch this video for step-by-step instructions:",309,61,429,508K,[],['@NFL'],"['\\U0001f3c8', '\\U0001f3c8']",https://pbs.twimg.com/profile_images/1442546093875630088/qOKkSb2Q_normal.jpg,https://x.com/TeamYouTube/status/1703435174665457880,tweet_id:1703435174665457880
YouTube Creators,@YouTubeCreators,2023-09-15T20:46:47.000Z,True,". &  are having a lil q&a sesh about the future of creation on YouTube join in on , Sept 22!! http://discord.gg/colinandsamir?event=1152331935138463834…",97,51,365,348K,[],"['@ColinandSamir', '@YouTubeLiaison', '@discord']","['\\u2728', '\\u2728']",https://pbs.twimg.com/profile_images/1861787453994004480/U4KJtASt_normal.jpg,https://x.com/YouTubeCreators/status/1702786057878856156,tweet_id:1702786057878856156
YouTube,@YouTube,2023-09-15T15:00:01.000Z,True,"this month and every month, we’re celebrating Latinx creators. thank you for sharing your stories, your communities, and your love ",682,702,625,625K,[],[],['\\U0001f496'],https://pbs.twimg.com/profile_images/1427292844612595720/RC1YSvuT_normal.jpg,https://x.com/YouTube/status/1702698791348953565,tweet_id:1702698791348953565
TeamYouTube,@TeamYouTube,2023-09-15T00:03:49.000Z,True,"if you plan to watch  Sunday Ticket from the YouTube app on your Smart TV, set up your location before the games on Sunday (don’t put this off until game time!!)

you’ll need to use your mobile device to verify your location, even if you watch on your TV

here’s how ",151,58,435,500K,[],['@NFL'],['\\u2b07\\ufe0f'],https://pbs.twimg.com/profile_images/1442546093875630088/qOKkSb2Q_normal.jpg,https://x.com/TeamYouTube/status/1702473255087403160,tweet_id:1702473255087403160
YouTube,@YouTube,2023-09-10T19:53:47.000Z,True,football szn is HERE! and we’ve got you with  Sunday Ticket,226,141,691,796K,[],['@NFL'],"['\\U0001f389', '\\U0001f3c8']",https://pbs.twimg.com/profile_images/1427292844612595720/RC1YSvuT_normal.jpg,https://x.com/YouTube/status/1700960784468054046,tweet_id:1700960784468054046
YouTube,@YouTube,2023-09-09T14:57:15.000Z,True,how've you found the YouTube el classico?  who do you think is going to win?   #SidemenCharityMatch,165,87,967,426K,['#SidemenCharityMatch'],['@Sidemen'],"['\\U0001f525', '\\U0001f914']",https://pbs.twimg.com/profile_images/1427292844612595720/RC1YSvuT_normal.jpg,https://x.com/YouTube/status/1700523768995586329,tweet_id:1700523768995586329
YouTube,@YouTube,2023-09-09T09:03:40.000Z,True,are you team goldbridge ball or team wingrove ball today?  #SidemenCharityMatch,139,97,693,464K,['#SidemenCharityMatch'],[],['\\U0001f914'],https://pbs.twimg.com/profile_images/1427292844612595720/RC1YSvuT_normal.jpg,https://x.com/YouTube/status/1700434789327593501,tweet_id:1700434789327593501
YouTube,@YouTube,2023-09-08T18:30:00.000Z,True,who's taking the W and the trophy home with them tomorrow   #SidemenCharityMatch,106,81,683,352K,['#SidemenCharityMatch'],['@Sidemen'],['\\U0001f440'],https://pbs.twimg.com/profile_images/1427292844612595720/RC1YSvuT_normal.jpg,https://x.com/YouTube/status/1700214922880160230,tweet_id:1700214922880160230
YouTube TV,@YouTubeTV,2023-09-07T22:13:59.000Z,True,Tap and hold or screenshot to see which team you should keep an eye on this season with  Sunday Ticket Let us know who you get in the comments ,220,119,521,570K,[],['@NFL'],"['\\U0001f440', '\\u2935\\ufe0f']",https://pbs.twimg.com/profile_images/1587489111807361025/AwvHDJyB_normal.jpg,https://x.com/YouTubeTV/status/1699908903121850561,tweet_id:1699908903121850561
YouTube TV,@YouTubeTV,2023-09-03T16:07:24.000Z,True,NEXT UP: OUR NFL DEBUT ,88,60,328,356K,[],[],['\\U0001f624'],https://pbs.twimg.com/profile_images/1587489111807361025/AwvHDJyB_normal.jpg,https://x.com/YouTubeTV/status/1698367096814469381,tweet_id:1698367096814469381
YouTube,@YouTube,2023-09-02T22:00:19.000Z,True,touched down in Vegas ,146,172,1.3K,781K,[],[],"['\\U0001f440', '\\U0001f3c8']",https://pbs.twimg.com/profile_images/1427292844612595720/RC1YSvuT_normal.jpg,https://x.com/YouTube/status/1698093523646423285,tweet_id:1698093523646423285
YouTube,@YouTube,2023-09-02T22:00:21.000Z,True,Get $50 off  Sunday Ticket to watch your favorite teams' out-of-market Sunday afternoon games! Offer ends 9/19 ,62,46,304,583K,[],['@NFL'],['\\u2b07\\ufe0f'],https://pbs.twimg.com/profile_images/1427292844612595720/RC1YSvuT_normal.jpg,https://x.com/YouTube/status/1698093531515002951,tweet_id:1698093531515002951
YouTube,@YouTube,2023-08-28T16:00:02.000Z,True,"If you didn’t win NFL Sunday Ticket for this season, you can still score $75 off ",31,29,201,185K,[],[],['\\U0001f389'],https://pbs.twimg.com/profile_images/1427292844612595720/RC1YSvuT_normal.jpg,https://x.com/YouTube/status/1696190913414889879,tweet_id:1696190913414889879
YouTube,@YouTube,2023-08-26T16:00:13.000Z,True,Not a winner? There’s still time to score $75 off NFL Sunday Ticket through 8/28! ,35,22,195,172K,[],[],"['\\U0001f389', '\\u2935\\ufe0f']",https://pbs.twimg.com/profile_images/1427292844612595720/RC1YSvuT_normal.jpg,https://x.com/YouTube/status/1695466186618605935,tweet_id:1695466186618605935
YouTube,@YouTube,2023-08-26T02:08:52.000Z,True,"Should we drop some hints??   

There are only 2  Sunday Ticket Subscriptions left!",140,139,1.4K,1.2M,[],['@NFL'],"['\\U0001f440', '\\u2b07\\ufe0f']",https://pbs.twimg.com/profile_images/1427292844612595720/RC1YSvuT_normal.jpg,https://x.com/YouTube/status/1695256968183554287,tweet_id:1695256968183554287
YouTube,@YouTube,2023-08-26T02:08:52.000Z,True,"Hint: We’ll give you 8,000,000 guesses where we hid the last two codes! ",50,23,152,207K,[],[],['\\U0001f3c8'],https://pbs.twimg.com/profile_images/1427292844612595720/RC1YSvuT_normal.jpg,https://x.com/YouTube/status/1695256969349673369,tweet_id:1695256969349673369
YouTube,@YouTube,2023-08-25T16:16:36.000Z,True,"today’s a good day for a challenge! here’s how to play:watch ’s old videosfind hidden QR codessee if you’re a winner

peep the deets here: https://yt.be/rDFWx",101,95,611,759K,[],['@MrBeast'],"['\\U0001f440', '\\U0001f50d', '\\U0001f31f']",https://pbs.twimg.com/profile_images/1427292844612595720/RC1YSvuT_normal.jpg,https://x.com/YouTube/status/1695107920227131895,tweet_id:1695107920227131895
YouTube,@YouTube,2023-08-23T16:00:01.000Z,True,reply with your mood & i’ll give you a hip hop rec ,2.1K,355,4.6K,2.3M,[],[],['\\U0001f60e'],https://pbs.twimg.com/profile_images/1427292844612595720/RC1YSvuT_normal.jpg,https://x.com/YouTube/status/1694378971368980770,tweet_id:1694378971368980770
